[
  {
    "id": "wu-lan-classic-bubble-milk-full-700",
    "name_zh": "50嵐 四季春珍珠奶茶（全糖）700ml",
    "brand_zh": "50嵐",
    "category": "珍珠奶茶",
    "size_ml": 700,
    "sugar_level": "full",
    "sugar_g": 72,
    "sugar_teaspoons": 18,
    "carbs_g": 95,
    "calories_kcal": 390,
    "fat_g": 4.5,
    "protein_g": 2,
    "gi_estimated": 65,
    "gl_estimated": 62,
    "toppings_included": true,
    "toppings": ["珍珠"],
    "who_daily_sugar_pct": 144,
    "source": "衛福部食藥署 2022 年連鎖飲料店抽查報告；50嵐官網營養標示",
    "notes": "珍珠（木薯澱粉）約含 35g 碳水、150 kcal，為熱量主要來源之一",
    "_meta": { "last_updated": "2026-04-07", "verified_by": "editorial_review" }
  },
  {
    "id": "wu-lan-classic-bubble-milk-half-700",
    "name_zh": "50嵐 四季春珍珠奶茶（半糖）700ml",
    "brand_zh": "50嵐",
    "category": "珍珠奶茶",
    "size_ml": 700,
    "sugar_level": "half",
    "sugar_g": 36,
    "sugar_teaspoons": 9,
    "carbs_g": 65,
    "calories_kcal": 285,
    "fat_g": 4.5,
    "protein_g": 2,
    "gi_estimated": 65,
    "gl_estimated": 42,
    "toppings_included": true,
    "toppings": ["珍珠"],
    "who_daily_sugar_pct": 72,
    "source": "衛福部食藥署 2022 年連鎖飲料店抽查報告；50嵐官網營養標示",
    "notes": "半糖版糖分仍高，但升糖負荷從 62 降至 42，相當於減少半碗白飯的碳水量",
    "_meta": { "last_updated": "2026-04-07", "verified_by": "editorial_review" }
  },
  {
    "id": "wu-lan-classic-bubble-milk-none-700",
    "name_zh": "50嵐 四季春珍珠奶茶（無糖）700ml",
    "brand_zh": "50嵐",
    "category": "珍珠奶茶",
    "size_ml": 700,
    "sugar_level": "none",
    "sugar_g": 8,
    "sugar_teaspoons": 2,
    "carbs_g": 40,
    "calories_kcal": 185,
    "fat_g": 4.5,
    "protein_g": 2,
    "gi_estimated": 60,
    "gl_estimated": 24,
    "toppings_included": true,
    "toppings": ["珍珠"],
    "who_daily_sugar_pct": 16,
    "source": "50嵐官網營養標示",
    "notes": "無糖版仍含珍珠的天然澱粉糖，sugar_g 8g 為珍珠中的殘餘糖分",
    "_meta": { "last_updated": "2026-04-07", "verified_by": "editorial_review" }
  },
  {
    "id": "coco-bubble-milk-full-700",
    "name_zh": "CoCo都可 珍珠奶茶（全糖）700ml",
    "brand_zh": "CoCo都可",
    "category": "珍珠奶茶",
    "size_ml": 700,
    "sugar_level": "full",
    "sugar_g": 68,
    "sugar_teaspoons": 17,
    "carbs_g": 90,
    "calories_kcal": 375,
    "fat_g": 5,
    "protein_g": 2.5,
    "gi_estimated": 65,
    "gl_estimated": 59,
    "toppings_included": true,
    "toppings": ["珍珠"],
    "who_daily_sugar_pct": 136,
    "source": "衛福部食藥署抽查報告；CoCo都可官方營養標示",
    "_meta": { "last_updated": "2026-04-07", "verified_by": "editorial_review" }
  },
  {
    "id": "coco-fresh-milk-tea-full-700",
    "name_zh": "CoCo都可 鮮奶茶（全糖）700ml",
    "brand_zh": "CoCo都可",
    "category": "鮮奶茶",
    "size_ml": 700,
    "sugar_level": "full",
    "sugar_g": 58,
    "sugar_teaspoons": 14.5,
    "carbs_g": 72,
    "calories_kcal": 320,
    "fat_g": 6,
    "protein_g": 5,
    "gi_estimated": 60,
    "gl_estimated": 43,
    "toppings_included": false,
    "toppings": [],
    "who_daily_sugar_pct": 116,
    "source": "CoCo都可官方營養標示",
    "notes": "使用鮮奶，蛋白質與脂肪較高，但糖分仍超過 WHO 每日上限",
    "_meta": { "last_updated": "2026-04-07", "verified_by": "editorial_review" }
  },
  {
    "id": "gong-cha-milk-tea-full-700",
    "name_zh": "貢茶 鐵觀音拿鐵（全糖）700ml",
    "brand_zh": "貢茶",
    "category": "鮮奶茶",
    "size_ml": 700,
    "sugar_level": "full",
    "sugar_g": 60,
    "sugar_teaspoons": 15,
    "carbs_g": 74,
    "calories_kcal": 310,
    "fat_g": 5,
    "protein_g": 4,
    "gi_estimated": 60,
    "gl_estimated": 44,
    "toppings_included": false,
    "toppings": [],
    "who_daily_sugar_pct": 120,
    "source": "貢茶官方網站公告營養資訊；衛福部食藥署抽查報告",
    "_meta": { "last_updated": "2026-04-07", "verified_by": "editorial_review" }
  },
  {
    "id": "gong-cha-milk-tea-half-700",
    "name_zh": "貢茶 鐵觀音拿鐵（半糖）700ml",
    "brand_zh": "貢茶",
    "category": "鮮奶茶",
    "size_ml": 700,
    "sugar_level": "half",
    "sugar_g": 30,
    "sugar_teaspoons": 7.5,
    "carbs_g": 44,
    "calories_kcal": 220,
    "fat_g": 5,
    "protein_g": 4,
    "gi_estimated": 58,
    "gl_estimated": 26,
    "toppings_included": false,
    "toppings": [],
    "who_daily_sugar_pct": 60,
    "source": "貢茶官方網站公告營養資訊",
    "_meta": { "last_updated": "2026-04-07", "verified_by": "editorial_review" }
  },
  {
    "id": "tiger-sugar-brown-sugar-boba-original-700",
    "name_zh": "老虎堂 黑糖珍珠鮮奶（原味）700ml",
    "brand_zh": "老虎堂",
    "category": "特調",
    "size_ml": 700,
    "sugar_level": "original",
    "sugar_g": 72,
    "sugar_teaspoons": 18,
    "carbs_g": 98,
    "calories_kcal": 400,
    "fat_g": 8,
    "protein_g": 7,
    "gi_estimated": 68,
    "gl_estimated": 67,
    "toppings_included": true,
    "toppings": ["黑糖珍珠"],
    "who_daily_sugar_pct": 144,
    "source": "老虎堂官方公開之熱量資訊；衛福部食藥署 2021 年手搖飲抽查",
    "notes": "黑糖珍珠為黑糖漿浸泡木薯，升糖速度快。此飲品為不可調糖（original）",
    "_meta": { "last_updated": "2026-04-07", "verified_by": "editorial_review" }
  },
  {
    "id": "yi-fang-fruit-tea-full-700",
    "name_zh": "一芳 台灣水果茶（全糖）700ml",
    "brand_zh": "一芳",
    "category": "水果茶",
    "size_ml": 700,
    "sugar_level": "full",
    "sugar_g": 75,
    "sugar_teaspoons": 19,
    "carbs_g": 78,
    "calories_kcal": 290,
    "fat_g": 0.5,
    "protein_g": 0.5,
    "gi_estimated": 62,
    "gl_estimated": 48,
    "toppings_included": false,
    "toppings": [],
    "who_daily_sugar_pct": 150,
    "source": "一芳官網；衛福部食藥署抽查",
    "notes": "水果茶通常無奶，熱量較珍奶低，但含糖量仍高。果糖比例高，GI 相對較低但肝臟代謝負擔大",
    "_meta": { "last_updated": "2026-04-07", "verified_by": "editorial_review" }
  },
  {
    "id": "yi-fang-fruit-tea-half-700",
    "name_zh": "一芳 台灣水果茶（半糖）700ml",
    "brand_zh": "一芳",
    "category": "水果茶",
    "size_ml": 700,
    "sugar_level": "half",
    "sugar_g": 38,
    "sugar_teaspoons": 9.5,
    "carbs_g": 40,
    "calories_kcal": 155,
    "fat_g": 0.5,
    "protein_g": 0.5,
    "gi_estimated": 60,
    "gl_estimated": 24,
    "toppings_included": false,
    "toppings": [],
    "who_daily_sugar_pct": 76,
    "source": "一芳官網",
    "_meta": { "last_updated": "2026-04-07", "verified_by": "editorial_review" }
  },
  {
    "id": "milksha-matcha-milk-half-700",
    "name_zh": "迷客夏 抹茶鮮奶（半糖）700ml",
    "brand_zh": "迷客夏",
    "category": "鮮奶茶",
    "size_ml": 700,
    "sugar_level": "half",
    "sugar_g": 40,
    "sugar_teaspoons": 10,
    "carbs_g": 54,
    "calories_kcal": 265,
    "fat_g": 7,
    "protein_g": 7,
    "gi_estimated": 55,
    "gl_estimated": 30,
    "toppings_included": false,
    "toppings": [],
    "who_daily_sugar_pct": 80,
    "source": "迷客夏官方公開熱量資訊",
    "notes": "使用台灣本地鮮奶，蛋白質與鈣質含量較一般奶茶高",
    "_meta": { "last_updated": "2026-04-07", "verified_by": "editorial_review" }
  },
  {
    "id": "tp-tea-assam-milk-full-700",
    "name_zh": "茶湯會 阿薩姆紅茶拿鐵（全糖）700ml",
    "brand_zh": "茶湯會",
    "category": "鮮奶茶",
    "size_ml": 700,
    "sugar_level": "full",
    "sugar_g": 62,
    "sugar_teaspoons": 15.5,
    "carbs_g": 76,
    "calories_kcal": 325,
    "fat_g": 5.5,
    "protein_g": 5,
    "gi_estimated": 60,
    "gl_estimated": 46,
    "toppings_included": false,
    "toppings": [],
    "who_daily_sugar_pct": 124,
    "source": "茶湯會官方網站公告",
    "_meta": { "last_updated": "2026-04-07", "verified_by": "editorial_review" }
  },
  {
    "id": "tp-tea-assam-milk-none-700",
    "name_zh": "茶湯會 阿薩姆紅茶拿鐵（無糖）700ml",
    "brand_zh": "茶湯會",
    "category": "鮮奶茶",
    "size_ml": 700,
    "sugar_level": "none",
    "sugar_g": 12,
    "sugar_teaspoons": 3,
    "carbs_g": 14,
    "calories_kcal": 170,
    "fat_g": 5.5,
    "protein_g": 5,
    "gi_estimated": 30,
    "gl_estimated": 4,
    "toppings_included": false,
    "toppings": [],
    "who_daily_sugar_pct": 24,
    "source": "茶湯會官方網站公告",
    "notes": "無糖鮮奶茶：少量糖來自牛奶中的乳糖（天然），無添加糖。是手搖飲中較低 GL 的選項",
    "_meta": { "last_updated": "2026-04-07", "verified_by": "editorial_review" }
  },
  {
    "id": "zhen-zhu-dan-brown-sugar-milk-original-700",
    "name_zh": "珍煮丹 黑糖玫瑰鮮奶（原味）700ml",
    "brand_zh": "珍煮丹",
    "category": "特調",
    "size_ml": 700,
    "sugar_level": "original",
    "sugar_g": 68,
    "sugar_teaspoons": 17,
    "carbs_g": 90,
    "calories_kcal": 380,
    "fat_g": 7.5,
    "protein_g": 6.5,
    "gi_estimated": 66,
    "gl_estimated": 59,
    "toppings_included": true,
    "toppings": ["黑糖珍珠"],
    "who_daily_sugar_pct": 136,
    "source": "珍煮丹官方公開資訊",
    "_meta": { "last_updated": "2026-04-07", "verified_by": "editorial_review" }
  },
  {
    "id": "wu-lan-yakult-green-full-700",
    "name_zh": "50嵐 多多綠（全糖）700ml",
    "brand_zh": "50嵐",
    "category": "特調",
    "size_ml": 700,
    "sugar_level": "full",
    "sugar_g": 78,
    "sugar_teaspoons": 19.5,
    "carbs_g": 82,
    "calories_kcal": 310,
    "fat_g": 1,
    "protein_g": 2,
    "gi_estimated": 62,
    "gl_estimated": 51,
    "toppings_included": false,
    "toppings": [],
    "who_daily_sugar_pct": 156,
    "source": "衛福部食藥署抽查報告 2022",
    "notes": "多多綠含多多乳酸菌飲料，乳糖與添加糖合計使糖分偏高。乳酸菌數量不足以提供益生菌效果",
    "_meta": { "last_updated": "2026-04-07", "verified_by": "editorial_review" }
  },
  {
    "id": "wu-lan-yakult-green-half-700",
    "name_zh": "50嵐 多多綠（半糖）700ml",
    "brand_zh": "50嵐",
    "category": "特調",
    "size_ml": 700,
    "sugar_level": "half",
    "sugar_g": 50,
    "sugar_teaspoons": 12.5,
    "carbs_g": 55,
    "calories_kcal": 205,
    "fat_g": 1,
    "protein_g": 2,
    "gi_estimated": 60,
    "gl_estimated": 33,
    "toppings_included": false,
    "toppings": [],
    "who_daily_sugar_pct": 100,
    "source": "衛福部食藥署抽查報告 2022",
    "notes": "半糖版仍達 WHO 每日游離糖建議上限（50g），需注意全天其他食物糖分來源",
    "_meta": { "last_updated": "2026-04-07", "verified_by": "editorial_review" }
  },
  {
    "id": "hey-tea-cheese-foam-oolong-full-500",
    "name_zh": "喜茶 芝士烏龍（全糖）500ml",
    "brand_zh": "喜茶",
    "category": "奶蓋茶",
    "size_ml": 500,
    "sugar_level": "full",
    "sugar_g": 45,
    "sugar_teaspoons": 11.5,
    "carbs_g": 52,
    "calories_kcal": 310,
    "fat_g": 12,
    "protein_g": 4,
    "gi_estimated": 58,
    "gl_estimated": 30,
    "toppings_included": true,
    "toppings": ["芝士奶蓋"],
    "who_daily_sugar_pct": 90,
    "source": "喜茶台灣官方公告",